{"version":"workkit-read/v1","connectionId":"left","profile":{"apiVersion":"workkit/v1alpha1","kind":"ConnectionProfile","metadata":{"id":"left","revision":1},"spec":{"apiVersion":"7.1","authRef":"credentials/left","basePath":"","origin":"https://dev.azure.com","provider":"azure-devops","scope":{"containerIds":["left-guid"],"tenantId":"tenant-left"},"transport":"rest"}},"source":{"version":"aok-tracker/v1","provider":"azure-devops","origin":"https://dev.azure.com","apiVersion":"7.1","nativeTenantId":"tenant-left","containerId":"left-guid","containerKey":"acme/left","principalPseudonym":"synthetic-p7-left","auth":{"mode":"bearer","tokenEnv":"AOK_TEST_TOKEN","usernameEnv":""},"scope":{"itemIds":["1"],"query":"","comments":false,"relations":false,"projects":false},"mappingVersion":"map-v1"}}
