{"version":"workkit-read/v1","connectionId":"right","profile":{"apiVersion":"workkit/v1alpha1","kind":"ConnectionProfile","metadata":{"id":"right","revision":1},"spec":{"apiVersion":"7.1","authRef":"credentials/right","basePath":"","origin":"https://dev.azure.com","provider":"azure-devops","scope":{"containerIds":["right-guid"],"tenantId":"tenant-right"},"transport":"rest"}},"source":{"version":"aok-tracker/v1","provider":"azure-devops","origin":"https://dev.azure.com","apiVersion":"7.1","nativeTenantId":"tenant-right","containerId":"right-guid","containerKey":"acme/right","principalPseudonym":"synthetic-p7-right","auth":{"mode":"bearer","tokenEnv":"AOK_TEST_TOKEN","usernameEnv":""},"scope":{"itemIds":["1"],"query":"","comments":false,"relations":false,"projects":false},"mappingVersion":"map-v1"}}
