{
  "version": "workkit-read/v1",
  "connectionId": "linear",
  "profile": {
    "apiVersion": "workkit/v1alpha1",
    "kind": "ConnectionProfile",
    "metadata": {
      "id": "linear",
      "revision": 1
    },
    "spec": {
      "provider": "linear",
      "origin": "https://api.linear.app",
      "basePath": "",
      "transport": "graphql",
      "authRef": "credentials/linear",
      "scope": {
        "tenantId": "workspace-guid",
        "containerIds": [
          "team-guid"
        ]
      },
      "apiVersion": "graphql"
    }
  },
  "source": {
    "version": "aok-tracker/v1",
    "provider": "linear",
    "origin": "https://api.linear.app",
    "apiVersion": "graphql",
    "nativeTenantId": "workspace-guid",
    "containerId": "team-guid",
    "containerKey": "ENG",
    "principalPseudonym": "test-principal",
    "auth": {
      "mode": "bearer",
      "tokenEnv": "AOK_TEST_TOKEN",
      "usernameEnv": ""
    },
    "scope": {
      "itemIds": [
        "1"
      ],
      "query": "",
      "comments": false,
      "relations": false,
      "projects": false
    },
    "mappingVersion": "map-v1"
  }
}
