{
  "version": "workkit-read/v1",
  "connectionId": "azure-devops",
  "profile": {
    "apiVersion": "workkit/v1alpha1",
    "kind": "ConnectionProfile",
    "metadata": {
      "id": "azure-devops",
      "revision": 1
    },
    "spec": {
      "provider": "azure-devops",
      "origin": "https://dev.azure.com",
      "basePath": "",
      "transport": "rest",
      "authRef": "credentials/azure-devops",
      "scope": {
        "tenantId": "tenant-guid",
        "containerIds": [
          "project-guid"
        ]
      },
      "apiVersion": "7.1"
    }
  },
  "source": {
    "version": "aok-tracker/v1",
    "provider": "azure-devops",
    "origin": "https://dev.azure.com",
    "apiVersion": "7.1",
    "nativeTenantId": "tenant-guid",
    "containerId": "project-guid",
    "containerKey": "acme/project",
    "principalPseudonym": "test-principal",
    "auth": {
      "mode": "bearer",
      "tokenEnv": "AOK_TEST_TOKEN",
      "usernameEnv": ""
    },
    "scope": {
      "itemIds": [
        "1"
      ],
      "query": "",
      "comments": false,
      "relations": false,
      "projects": false
    },
    "mappingVersion": "map-v1"
  }
}
